{
  "schema": "review.publish/v1",
  "message_id": "fac09109-716a-548b-a602-a28f1c09c2f0",
  "run_id": "4fabfd21-5acc-4351-a99c-349dffdc00cf",
  "head_sha": "e1f145f3d2917526e06c206444f6c3dee1826946",
  "findings_hash": "43dc12ccabe896ca239eb0a81e11d6ec0bb1e1bc812e0124c01af35d539201e2",
  "review_event": "COMMENT"
}
